{
 "problemID": 0,
 "neighbors": {
  "0": "1,2",
  "1": "0",
  "2": "0"
 },
 "numberOfRelations": 3,
 "relations": [
  {
   "cardinality": 4377.141871869801,
   "name": "unknown",
   "problemID": 0,
   "relationID": 0
  },
  {
   "cardinality": 4246.374970712657,
   "name": "unknown",
   "problemID": 0,
   "relationID": 1
  },
  {
   "cardinality": 6868.230728671094,
   "name": "unknown",
   "problemID": 0,
   "relationID": 2
  }
 ],
 "selectivities": {
  "0,1": 0.06563701921747622,
  "0,2": 0.15651925473279124
 }
}